ID	English	Spanish
d004.s001	This document is a summary of the European Public Assessment Report.	Resumen del EPAR para el público general
d004.s002	It explains how the Committee for Medicinal Products for Veterinary Use (CVMP) assessed the studies performed, to reach their recommendations on how to use the medicine.	En el presente documento se resume el Informe Público Europeo de Evaluación , y se explica cómo la evaluación del Comité de Medicamentos de Uso Veterinario ( CVMP ) , efectuada a partir de los estudios existentes , ha llevado a las recomendaciones sobre las condiciones de uso del medicamento .
d004.s003	What is Cerenia?	¿Qué es Cerenia ?
d004.s004	Cerenia contains the active substance maropitant and is available as tablet or as solution for injection.	Cerenia contiene el principio activo maropitant y se presenta en forma de comprimidos o de solución inyectables .
d004.s005	The tablets are pale-orange and have a score line on both sides so that they can be halved.	Los comprimidos son de color naranja claro y tienen una ranura en ambas caras , lo que permite dividirlos por la mitad .
d004.s006	Each tablet is marked with the Pfizer logo on one side and with the letters MPT and the quantity of maropitant on the other side.	Cada comprimido va marcado con el logo Pfizer en una cara y las letras MPT y la cantidad de maropitant en la otra .
d004.s007	What is Cerenia used for?	¿Para qué se utiliza Cerenia ?
d004.s008	Cerenia is an anti-emetic, this means that it stops vomiting.	Cerenia es un antiemético ( ataja los vómitos ) .
d004.s009	It is used in dogs to prevent vomiting such as vomiting caused by chemotherapy (medicines used for the treatment of cancer, some of which are known to cause vomiting).	Se utiliza en perros para la prevención de los vómitos , por ejemplo los causados por la quimioterapia ( fármacos utilizados para el tratamiento del cáncer , algunos de los cuales producen vómitos ) .
d004.s010	In combination with supportive measures such as other veterinary treatment or a special diet, Cerenia can also be used in the treatment of vomiting (either as injection or as injection followed by tablets).	Combinado con otras medidas complementarias , como otros tratamientos veterinarios o una dieta especial , Cerenia se utiliza también como tratamiento del vómito ( como inyección o como inyección seguida de comprimidos ) .
d004.s011	For these purposes, Cerenia can be given for up to five days	A estos efectos , Cerenia se puede administrar durante un período de hasta cinco días .
d004.s012	How does Cerenia work?	¿Cómo actúa Cerenia ?
d004.s013	Cerenia blocks a neurokinin 1 (NK1) receptor, which acts in the central nervous system.	Cerenia bloquea los receptores de neurocinina 1 ( NK1 ) en el sistema nervioso central .
d004.s014	How has Cerenia been studied?	¿Qué tipo de estudios se han realizado sobre Cerenia ?
d004.s015	A large number of studies with Cerenia were carried out either in laboratory dogs or in animal patients at veterinary practises in several European countries and in the USA.	Se han realizado una gran cantidad de estudios con Cerenia en perros de laboratorio y en perros pacientes de clínicas veterinarias de varios países europeos y de EE.UU.
d004.s016	What benefit has Cerenia shown during the studies?	¿Qué beneficios ha demostrado Cerenia durante dichos estudios ?
d004.s017	The results of the studies showed that Cerenia was more effective than the placebo: less vomiting was seen in dogs that received the medicine than in dogs that received a placebo, both in the treatment or in the prevention of vomiting.	Los resultados de los estudios demostraron que Cerenia fue más eficaz que el placebo : se observaron menos vómitos en los perros que recibieron el medicamento que en los perros que recibieron placebo , bien como tratamiento , bien como prevención del vómito .
d004.s018	The treatment of a vomiting dog should be started with the injection, since vomiting animals might not be able to keep a tablet down (as they might throw the intact tablet up again).	El tratamiento de un perro con vómitos debe iniciarse en forma inyectable puesto que los animales con vómitos podrían no retener el comprimido ( podrían vomitar el comprimido intacto ) .
d004.s019	For follow-up treatment, the animal owner can administer the tablets to the dog.	Para la continuación del tratamiento , el propietario puede administrar el medicamento al animal en forma de comprimidos .
d004.s020	Also, the treatment of vomiting should only be together with other supportive measure or other veterinary therapy while addressing the underlying causes of the vomiting.	El tratamiento del vómito debe realizarse siempre en asociación con otras medidas de apoyo u otros tratamientos veterinarios para combatir también la causa subyacente del vómito .
d004.s021	What is the risk associated with Cerenia?	¿Cuáles son los efectos secundarios de Cerenia ?
d004.s022	Cerenia was generally well tolerated when administered daily at dosages up to 5 times the recommended doses for an extended period of time (up to 3 times the recommended maximum duration of treatment).	En general , Cerenia fue bien tolerado cuando se administró diariamente a dosis de hasta 5 veces la dosis recomendada durante un período de tiempo prolongado ( hasta 3 veces la duración máxima recomendada del tratamiento ) .
d004.s023	What are the precautions for the person who gives the medicine or comes into contact with the animal?	¿Qué precauciones debe adoptar la persona que administre el medicamento o esté en contacto con el animal ?
d004.s024	Cerenia does not represent a particular risk for people.	Cerenia no presenta ningún riesgo especial para el ser humano .
