ID	English	Farsi Translation
d003.s009	As important industrial sectors , the metal industry and the banking sector were also included .	به عنوان بخشهای مهم صنعتی، صنعت فلز و بخش بانکی نیز در این بخش گنجانده شدند.
d003.s010	Key speakers at the social exclusion conference were ( left to right ) Cristina Louro , Employment , Industrial Relations and Social Affairs Directorate , European Commission Fernando Gomes , a high degree of Committee of the Regions Barbara Weiler , Member of the European Parliament José Maria Gil-Robles , Vice-President , European Parliament and John Carroll , Economic and Social Committee .	سخنرانان کلیدی در کنفرانس طرد اجتماعی عبارت بودند از (از چپ به راست) کریستینا لورو، اداره استخدام، روابط صنعتی و امور اجتماعی، کمیسیون اروپا فرناندو گومز، یک درجه عالی از کمیته مناطق باربارا ویلر، عضو پارلمان اروپا خوزه ماریا گیل- روبلز، معاون رئیس جمهور، پارلمان اروپا و جان کارول، کمیته اقتصادی و اجتماعی.
d003.s011	Case Studies Each national report contains a portfolio of between 25 and 30 initiatives which best present policies and practices to improve the recruitment , training and development of ageing workers in both the work place and the community .	مطالعات موردی هر گزارش ملی شامل مجموعه ای از بین 25 تا 30 ابتکار است که به بهترین وجه سیاست ها و شیوه ها را برای بهبود استخدام، آموزش و توسعه کارگران سالخورده در محل کار و جامعه ارائه می دهد.
d003.s012	For each country , two or three initiatives have been selected for further in depth case study .	برای هر کشور، دو یا سه طرح برای مطالعه موردی عمیق انتخاب شده است.
d003.s013	These case studies analysed the background of the initiatives , their impact on employment patterns and work organisations and assessed the benefits and problems of the initiative .	این مطالعات موردی پیشینه ابتکارات، تأثیر آنها بر الگوهای اشتغال و سازمان های کاری را تجزیه و تحلیل کرده و مزایا و مشکلات طرح را ارزیابی کردند.
d003.s014	Visits and interviews with key personnel were also undertaken .	بازدید و مصاحبه با پرسنل کلیدی نیز انجام شد.
d003.s015	These national studies will form the basis of a European report which synthesises overall practices .	این مطالعات ملی اساس یک گزارش اروپایی را تشکیل خواهد داد که شیوه های کلی را ترکیب می کند.
d003.s016	The report and a case book of initiatives will be published in 1996 and provide the backdrop for a conference to be staged in Autumn , 1996 .	گزارش و کتاب موردی از ابتکارات در سال 1996 منتشر می شود و زمینه برگزاری کنفرانسی را فراهم می کند که در پاییز 1996 برگزار می شود.
d003.s017	The Foundation aims to document the characteristics of age barriers in job recruitment and training and to analyse their causes .	هدف این بنیاد مستندسازی ویژگی‌های موانع سنی در استخدام و آموزش و تحلیل علل آن است.
d003.s018	The perspectives of the social partners is also being examined , with particular attention paid to proposals for removing age barriers .	دیدگاه های شرکای اجتماعی نیز با توجه ویژه به پیشنهادات برای رفع موانع سنی مورد بررسی قرار می گیرد.
d003.s019	Thirdly , the project documents and assesses initiatives , in both the public and private sectors which combat age barriers , especially for older workers .	ثالثاً، پروژه ابتکارات را در هر دو بخش دولتی و خصوصی که با موانع سنی، به ویژه برای کارگران مسن تر مبارزه می کنند، مستند و ارزیابی می کند.
d003.s020	Seeking alternatives to early retirement and redundancy , the project is primarily concerned with the retention , reintegration and retraining of older workers .	به دنبال جایگزینی برای بازنشستگی پیش از موعد و اخراج، این پروژه در درجه اول به حفظ، ادغام مجدد و بازآموزی کارگران مسن تر می پردازد.
d003.s021	The gender and ethnic backgrounds of workers and how these relate to age discrimination are examined .	پیشینه های جنسیتی و قومی کارگران و چگونگی ارتباط آنها با تبعیض سنی مورد بررسی قرار می گیرد.
d003.s022	The project also considers initiatives to combat age discrimination in rural areas and in small and medium sized enterprises .	این پروژه همچنین ابتکاراتی را برای مبارزه با تبعیض سنی در مناطق روستایی و در شرکت های کوچک و متوسط در نظر می گیرد.
d003.s023	Seven member states are covered by the project : Belgium , France , Germany , Greece , Italy , the Netherlands and the United Kingdom .	هفت کشور عضو تحت پوشش این پروژه هستند: بلژیک، فرانسه، آلمان، یونان، ایتالیا، هلند و بریتانیا.
d004.s001	This document is a summary of the European Public Assessment Report .	این سند خلاصه ای از گزارش ارزیابی عمومی اروپا است.
d004.s002	It explains how the Committee for Medicinal Products for Veterinary Use ( CVMP ) assessed the studies performed , to reach their recommendations on how to use the medicine .	این توضیح می دهد که چگونه کمیته محصولات دارویی برای استفاده دامپزشکی (CVMP) مطالعات انجام شده را ارزیابی کرد تا به توصیه های آنها در مورد نحوه استفاده از دارو برسد.
d004.s003	What is Cerenia ?	سرنیا چیست؟
d004.s004	Cerenia contains the active substance maropitant and is available as tablet or as solution for injection .	سرنیا حاوی ماده فعال ماروپیتانت است و به صورت قرص یا محلول تزریقی موجود است.
d004.s005	The tablets are pale-orange and have a score line on both sides so that they can be halved .	این قرص ها به رنگ نارنجی کم رنگ هستند و در هر دو طرف دارای یک خط نمره هستند که می توان آنها را نصف کرد.
d004.s006	Each tablet is marked with the Pfizer logo on one side and with the letters MPT and the quantity of maropitant on the other side .	هر تبلت در یک طرف با نشان فایزر و در طرف دیگر با حروف MPT و مقدار maropitant مشخص شده است.
d004.s007	What is Cerenia used for ?	Cerenia برای چه مواردی استفاده می شود؟
d004.s008	Cerenia is an anti-emetic , this means that it stops vomiting .	سرنیا ضد استفراغ است، به این معنی که استفراغ را متوقف می کند.
d004.s009	It is used in dogs to prevent vomiting such as vomiting caused by chemotherapy ( medicines used for the treatment of cancer , some of which are known to cause vomiting ) .	این دارو در سگ ها برای جلوگیری از استفراغ مانند استفراغ ناشی از شیمی درمانی (داروهایی که برای درمان سرطان استفاده می شود، که برخی از آنها باعث استفراغ می شوند) استفاده می شود.
d004.s010	In combination with supportive measures such as other veterinary treatment or a special diet , Cerenia can also be used in the treatment of vomiting ( either as injection or as injection followed by tablets ) .	در ترکیب با اقدامات حمایتی مانند سایر درمان‌های دامپزشکی یا رژیم غذایی خاص، سرنیا می‌تواند در درمان استفراغ (به صورت تزریقی یا تزریقی و به دنبال آن قرص) نیز استفاده شود.
d004.s011	For these purposes , Cerenia can be given for up to five days	برای این منظور، Cerenia می تواند تا پنج روز داده شود
d004.s012	How does Cerenia work ?	سرنیا چگونه کار می کند؟
d004.s013	Cerenia blocks a neurokinin 1 ( NK1 ) receptor , which acts in the central nervous system .	سرنیا گیرنده نوروکینین 1 (NK1) را که در سیستم عصبی مرکزی عمل می کند، مسدود می کند.
d004.s014	How has Cerenia been studied ?	Cerenia چگونه مورد مطالعه قرار گرفته است؟
d004.s015	A large number of studies with Cerenia were carried out either in laboratory dogs or in animal patients at veterinary practises in several European countries and in the USA .	تعداد زیادی از مطالعات با Cerenia بر روی سگ های آزمایشگاهی یا در بیماران حیوانی در مراکز دامپزشکی در چندین کشور اروپایی و در ایالات متحده انجام شد.
d004.s016	What benefit has Cerenia shown during the studies ?	Cerenia در طول مطالعات چه فوایدی را نشان داده است؟
d004.s017	The results of the studies showed that Cerenia was more effective than the placebo : less vomiting was seen in dogs that received the medicine than in dogs that received a placebo , both in the treatment or in the prevention of vomiting .	نتایج مطالعات نشان داد که Cerenia موثرتر از دارونما بود: در سگهایی که دارو دریافت کردند، استفراغ کمتری نسبت به سگهایی که دارونما دریافت کردند، هم در درمان و هم در پیشگیری از استفراغ مشاهده شد.
d004.s018	The treatment of a vomiting dog should be started with the injection , since vomiting animals might not be able to keep a tablet down ( as they might throw the intact tablet up again ) .	درمان سگ استفراغ کننده باید با تزریق شروع شود، زیرا حیوانات استفراغ کننده ممکن است نتوانند قرص را پایین نگه دارند (زیرا ممکن است دوباره قرص دست نخورده را به بالا پرتاب کنند).
d004.s019	For follow-up treatment , the animal owner can administer the tablets to the dog .	برای درمان بعدی، صاحب حیوان می تواند قرص ها را به سگ بدهد.
d004.s020	Also , the treatment of vomiting should only be together with other supportive measure or other veterinary therapy while addressing the underlying causes of the vomiting .	همچنین، درمان استفراغ تنها باید همراه با سایر اقدامات حمایتی یا سایر درمان های دامپزشکی باشد و در عین حال به علل زمینه ای استفراغ رسیدگی شود.
d004.s021	What is the risk associated with Cerenia ?	خطر مرتبط با سرنیا چیست؟
d004.s022	Cerenia was generally well tolerated when administered daily at dosages up to 5 times the recommended doses for an extended period of time ( up to 3 times the recommended maximum duration of treatment ) .	زمانی که سرنیا روزانه در دوزهای تا 5 برابر دوزهای توصیه شده برای مدت زمان طولانی (تا 3 برابر حداکثر مدت زمان توصیه شده درمان) تجویز می شد، عموماً به خوبی تحمل می شد.
d004.s023	What are the precautions for the person who gives the medicine or comes into contact with the animal ?	برای فردی که دارو می دهد یا با حیوان تماس پیدا می کند چه اقدامات احتیاطی وجود دارد؟
d004.s024	Cerenia does not represent a particular risk for people .	Cerenia خطر خاصی را برای مردم نشان نمی دهد.
